{
  "id": "RIA-0002",
  "kind": "rule_situation_intent_analysis_intake",
  "status": "processed",
  "source": {
    "rule_id": "NOM-0002",
    "path": "rules/NOM-0002.json",
    "version": "1.1.1",
    "status_at_snapshot": "draft",
    "snapshot_commit": "ab9b06e947284dab83fe19519be21dc1b0ad5051",
    "git_blob_sha": "c0cb31ce9394343e515dbc28362bab18a623f413"
  },
  "requested_analysis": [
    "applicable_situations",
    "desired_outcomes",
    "atomicity_and_nonintent_roles",
    "existing_ontology_reuse",
    "candidate_semantic_links"
  ],
  "authorization": {
    "intake_authorized": true,
    "processing_authorized": false,
    "normalization_authorized": false,
    "publication_authorized": false,
    "canonical_rule_edit_authorized": false,
    "profile_edit_authorized": false
  },
  "governance": {
    "queued_on": "2026-10-24",
    "source_basis": "existing_public_canonical_rule"
  },
  "processing": {
    "state": "closed",
    "record": "processing/rule-situation-intent/PROC-RIA-0002.json",
    "authorized_on": "2026-10-24",
    "authorization": "owner_explicit_full_processing_request"
  }
}
